{
  "name": "Uniswap V2 Unsupported List",
  "timestamp": "2021-01-05T20:47:02.923Z",
  "version": {
    "major": 1,
    "minor": 0,
    "patch": 0
  },
  "tags": {},
  "logoURI": "ipfs://QmNa8mQkrNKp1WEEeGjFezDmDeodkWRevGFN8JCV7b4Xir",
  "keywords": ["uniswap", "unsupported"],
  "tokens": [

  ]
}
